Parent ASIN,Title,Brand,Variant 1,Variant 2,Variant 3,Variant 4,Variant 5,Variant 6,Variant 7,Variant 8,Variant 9,Variant 10
B0BD6QBJC2,"THE GYM PEOPLE Womens' Half Zip Pullover Fleece Stand Collar Crop Sweatshirt with Pockets Thumb Hole Grey Medium","THE GYM PEOPLE",B0CCR981J6,B0CCRC4GHW,B0BD71VTV1,B0BKSXXBCX,B0BD55VK36,B0CCRCP1FF,B0CCRD31DG,B0CG1FQWJY,B0BD6V5QST,B0DBQ8HXTS
B0BD7BNNSM,"THE GYM PEOPLE Womens' Hoodies Half Zip Long Sleeve Fleece Crop Pullover Sweatshirts with Pockets Thumb Hole Off-white Medium","THE GYM PEOPLE",B0CG1FJ77J,B0BD7P7XMS,B0BD7BLL5V,B0DKTGZ95D,B0DKTG37DP,B0BD78CKBX,B0BKSX1XJC,B0DKTGCH6Q,B0CCRF13X6,B0BD7BF563
B0BGBQ3K1J,"THE GYM PEOPLE Men's Fleece Crewneck Sweatshirt Thick Loose fit Soft Basic Pullover Sweatshirt Dark Grey Small","THE GYM PEOPLE",B0BGBVRSN4,B0CLRK3PCH,B0BGC38KFY,B0BGBPWHHQ,B0BGBRTMXS,B0BGBSLJHJ,B0BGBYHF4B,B0BGBQCLNH,B0BGBQ33HD,B0BGBYF4KN
B0BGC5CGB4,"THE GYM PEOPLE Men's Fleece Pullover Hoodie Loose Fit Ultra Soft Hooded Sweatshirt With Pockets Small Brown","THE GYM PEOPLE",B0BGBZ7XFR,B0BGBXRR49,B0BGBY7DC5,B0BGBZHQBR,B0BGBW7Q7L,B0BGBVTNMR,B0BGCC9SF9,B0CLRRZCL7,B0CLRPQ7RK,B0CLRSJ71D
B0DHRPQKXR,"THE GYM PEOPLE Women's Zip Up Hoodies Fleece Workout Jackets Sweatshirts with Pockets Thumb Hole Heather White X-Large","THE GYM PEOPLE",B0DHRPYCPH,B0DHRNX9XY,B0DHRNP1CK,B0DHRP36C6,B0DHRNLLBL,B0DHRQ2T3D,B0DHRNL93S,B0DHRN8NPT,B0DHRND1P2,B0DHRLGYPR
B0BD517RTZ,"THE GYM PEOPLE Women's Full-Zip Up Hoodies Jacket Fleece Workout Crop Tops Sweatshirts with Pockets Thumb Hole X-Small Grey","THE GYM PEOPLE",B0CJRP45KC,B0BD54ZZR3,B0CJRPM3MM,B0BL7R36WD,B0BD54B38Y,B0BD541D4K,B0BD52BS6X,B0BD4ZZ6GT,B0BD53J6WS,B0BD5QPV4M
B0DFW23FG6,"THE GYM PEOPLE Men's Half Zip Fleece Pullover Sweatshirts Midweight Mock Neck Workout Sweat Tops Grey Large","THE GYM PEOPLE",B0DFW2K7CM,B0DFW12HN6,B0DFW1DFM1,B0DFW1DDDK,B0DFW1W6CS,B0DFVZYF1S,B0DFW1NVMM,B0DFW1DYRJ,B0DFW193W5,B0DFW1TMQK
B07YHGLKTB,"THE GYM PEOPLE Mens' Fleece Joggers Pants with Deep Pockets in Loose-fit Style Unlined Lightweight Basic Light Grey Small","THE GYM PEOPLE",B0DFLS3X38,B09KX4DYPC,B089ZVV3LK,B089ZWS38S,B09FJBZGP6,B0DFLQ6MZY,B09C8J12ST,B0831J6ML3,B089ZS1BD4,B07YHHMHL7
B0D6WHCGMY,"THE GYM PEOPLE Thick High Waist Yoga Pants with Pockets, Tummy Control Workout Running Yoga Leggings for Women Grey Purple Small","THE GYM PEOPLE",B0BCW6XYY2,B0CJ4J3492,B0BGBWVMFD,B08K4G27QH,B0CJ4HJF7N,B0DF7NH9M1,B0CJ4GL4JN,B07Q1H64QP,B0CJ4HV923,B0CJ4G1QBF
B07ZP7L2X9,"THE GYM PEOPLE Women's Joggers Pants Lightweight Athletic Leggings Tapered Lounge Pants for Workout, Yoga, Running Medium Bright Grey","THE GYM PEOPLE",B0CHVTB5Y1,B0CHVR6JCG,B085PSTGC9,B07ZPMPG1Q,B0DFLW29S6,B0BCJS9M3M,B08BP16XQF,B0DFLY97JG,B0DFLKVPB9,B08BP5BRT4
B0D5LGBCSS,"THE GYM PEOPLE Tummy Control Workout Leggings with Pockets High Waist Athletic Yoga Pants for Women Running, Fitness Dark Blue Green X-Large","THE GYM PEOPLE",B0D6W6VKMR,B08G86WSPM,B0DHWRRMP9,B08G873RBQ,B0DHWQWR1X,B0DHWRP43V,B08G83GBLQ,B0DHWQT6PP,B0D6W8BF6R,B0BGBTMDVX
B0DLW33WP5,"THE GYM PEOPLE Women's High Waisted Jeggings Pants Stretchy Tummy Control Skinny Jean Leggings with Pockets Denim Blue Small","THE GYM PEOPLE",B0DLW7VNQV,B0DLW3HZGD,B0DLW5SJQF,B0DLW4D856,B0DLW4TS62,B0DLW5H12F,B0DLW36932,B0DLWBM8JT,,
B0DFWP9YLF,"THE GYM PEOPLE Women's High Waist Drawstring Stretchy Workout Leggings Ultra Soft Tummy Control Yoga Pants with Pockets Grey Green Heather Medium","THE GYM PEOPLE",B0DFWQLR99,B0DFWP24WG,B0DFWP7VCS,B0DFWNFT9F,B0DFWMWS6B,B0DFWLJCSW,B0DFWMG117,B0DFWQTYSY,B0DFWP1QDN,B0DFWP39GD
B0DFY9PQZ4,"THE GYM PEOPLE Women's High Waist Yoga Leggings Ultra Stretchy Soft Breathable Tummy Control Running Workout Pants Charcoal Grey Small-Medium","THE GYM PEOPLE",B0DFYBXLR7,B0DFYB61FY,B0DFY9TBXN,B0DFY9PR1X,B0DFY8KMLQ,B0DFY8BN5N,B0DFYBKQNK,B0DFY97D5M,B0DFY9FHGR,B0DFYB8498
B0DFWNJKKX,"THE GYM PEOPLE Women's High Waist Yoga Pants Soft Tummy Control Athletic Workout Leggings with Deep Pockets Navy Blue Medium","THE GYM PEOPLE",B0DFWNNVW5,B0DFWNFQMG,B0DFWNZJX8,B0DGQ5WX4Q,B0DFWNCSL6,B0DFWQ8L28,B0DFWP59R8,B0DFWNQ192,B0DGQ1WJ6C,B0DFWMVSQD
B0CH2Z6HVY,"THE GYM PEOPLE Women's Long Sleeve Workout Shirts Back Loose Fit Running Tee Tops with Thumb Hole Small Light Blue","THE GYM PEOPLE",B0CH33CSHM,B0CH327X57,B0DCJH4FXF,B0CH3259RQ,B0CH32THW7,B0DCJBSWBY,B0CH31P6W5,B0DCHYT391,B0DCJNQTF9,B0DCHVTCRF
B0CCJFKZKK,"THE GYM PEOPLE Women's Long Sleeve Workout Shirts Athletic Crewneck Hiking Tops with Thumb Hole Medium White","THE GYM PEOPLE",B0DF753YSD,B0CN14QL92,B0CCJK2QLX,B0CN14D36F,B0DF752RPJ,B0DF759SB4,B0CCJKSX52,B0DF74W94W,B0CCJHTMNX,B0DF75WR1V
B0D8KXGZZ6,"THE GYM PEOPLE Women's Soft Oversized Sweatshirt Crewneck Loose fit Lightweight Pullover Tops Light Grey Large","THE GYM PEOPLE",B0D8KX5KWN,B0D8KSLH8T,B0D8KYTNMT,B0D8KVC7DR,B0D8KZ4G7D,B0D8KXMKJB,B0D8KVLTD1,B0D8KX6X22,B0D8KXVKTL,B0D8KX2492
B0DG5HR2MJ,"THE GYM PEOPLE Women's Loose Fit Fleece Sweatshirts Crewneck Long Sleeve Pullover Tops Lavender Purple Large","THE GYM PEOPLE",B0DG575QF6,B0DG4TC4HS,B0DG4RQH3B,B0DG4W658J,B0DG52MDJS,B0DG4T2VYS,B0DG54XNGL,B0DG4YRC1C,B0DG4WGLG2,B0DG4SN83J
B088M5YWPZ,"THE GYM PEOPLE Womens' Sports Bra Longline Wirefree Padded with Medium Support White Large","THE GYM PEOPLE",B08CKLTNFJ,B08CK9WJ1C,B094GQ8DT5,B093Q6W6FT,B0BC9848F6,B094GQ1TH9,B0BC923RB4,B08CKGZJWQ,B0BG2FQMG8,B0BZ85JN8B
B0CYPLMSL1,"THE GYM PEOPLE Women's Adjustable Longline Sports Bras Scoop Neck Padded Wireless Workout Yoga Tops Denim Blue Medium","THE GYM PEOPLE",B0CYPJ27N3,B0CYP3YTYT,B0CYP2NDCG,B0CYP4SGHN,B0CYP7L7QG,B0CYPCD2SG,B0CYPJ2LGT,B0CYP2PD7F,B0DCDYVQ8X,B0CYP6RZNL
B0DHFJ9KQT,"THE GYM PEOPLE Girls Soft Workout Sweatpants Lightweight Casual Athletic Joggers Pants with Pockets Light Blue Small","THE GYM PEOPLE",B0DHFRBCGT,B0DHFYZB36,B0DHFR7GHH,B0DHFTK8XL,B0DHG21JT9,B0DHG7JM59,B0DHFMYG7N,B0DHFV1TQ6,B0DHFYB2P4,B0DHFMP6KK
B0DHFV42ZF,"THE GYM PEOPLE Girl's Fleece Tapered Workout Sweatpants Warm Soft Athletic Joggers Pants with Pockets Pink X-Small","THE GYM PEOPLE",B0DHG2BHTM,B0DHFPVFCK,B0DHG3YS8V,B0DHFN514F,B0DHFRM9GH,B0DHFRNYBN,B0DHFT4KJX,B0DHG1NVKB,B0DHFMRF2L,B0DHFX6Z6B
